Symbol,Company Name,LTP,% Change,Open,High,Low,Quantity,Trend
TTL,Trade Tower Limited,773.0,1.98,776.9,757.0,758.0,28745,increase
TVCL,Trishuli Jal Vidhyut Company Limited,415.6,-0.69,419.0,411.3,418.5,6372,decrease
UAIL,United Ajod Insurance Limited ,468.0,0.43,472.9,462.2,472.9,13451,increase
UHEWA,Upper Hewakhola Hydropower Company Limited,612.0,-1.1,622.9,610.1,620.0,22462,decrease
ULBSL,Upakar Laghubitta Bittiya Sanstha Limited,3850.0,-1.15,4125.0,3740.8,3817.1,918,decrease
ULHC,Upper Lohore Khola Hydropower Company Limited,460.0,-1.92,475.0,458.0,465.1,18830,decrease
UMHL,United Modi Hydropower Ltd.,564.7,4.13,566.9,535.1,540.0,263596,increase
UMRH,United IDI Mardi RB Hydropower Limited.,583.5,2.37,586.0,570.0,570.0,35910,increase
UNHPL,Union Hydropower Limited,504.6,-0.47,513.8,497.0,497.0,173118,decrease
UNL,Unilever Nepal Limited,46700.0,-1.37,46900.0,46600.0,46900.0,45,decrease
UNLB,Unique Nepal Laghubitta Bittiya Sanstha Limited,2012.0,0.1,2025.0,1995.5,2000.0,1488,increase
UPCL,UNIVERSAL POWER COMPANY LTD,376.0,-1.54,386.0,374.6,378.9,105912,decrease
UPPER,Upper Tamakoshi Hydropower Ltd,183.0,0.55,183.0,180.0,182.0,58588,increase
USHEC,Upper Solu Hydro Electric Company Limited ,487.0,0.21,489.9,482.0,482.0,26019,increase
USHL,Upper Syange  Hydropower Limited,689.0,0.15,692.0,681.5,688.0,3864,increase
USLB,Unnati Sahakarya Laghubitta Bittiya Sanstha Limited,1694.1,-2.64,1774.0,1666.0,1774.0,23351,decrease
VLBS,Vijaya laghubitta Bittiya Sanstha Ltd.,814.8,1.72,816.9,803.1,815.0,2058,increase
VLUCL,Vision Lumbini Urja Company Limited,562.9,-0.2,562.9,555.0,555.0,4292,decrease
WNLB,WEAN Nepal Laghubitta Bittiya Sanstha Limited,1998.5,-0.57,2015.0,1980.0,1982.0,618,decrease
